{
  "attestations": {
    "forward_shadow": {
      "decision": "pass",
      "path": "experiments/learning/promoter/rollback-drill/forward_shadow_attestation.json",
      "sha256": "0d2ee856bd12d945f0e222c79a302ce115cc0e0025efa40e69f2347850247697"
    },
    "holdout": {
      "decision": "pass",
      "path": "experiments/learning/promoter/rollback-drill/holdout_attestation.json",
      "sha256": "78829f9dce3e1a14d9c2a7361e2e68966d6e34504b355a8826821ab9b5d60dfc"
    },
    "search": {
      "decision": "pass",
      "path": "experiments/learning/promoter/rollback-drill/search_attestation.json",
      "sha256": "6fb4c29e8a5aeba16853114d697632c031b1933d74e2dadd3d0d5a62112bb3cd"
    }
  },
  "binding_manifest": {
    "manifest_id": "p13-learning-baseline-migration:64575751a361:20260710T212634Z",
    "path": "runs/p13_manifests/p13-learning-baseline-migration-v6.json",
    "sha256": "7d4d2c7db1a3a858905251d54f718c5ca6666026117adbd48a7579c95830239a"
  },
  "created_at": "2026-07-10T21:28:52.891721Z",
  "decision": "pass",
  "instrument_bundle": {
    "bundle_sha256": "bb7325267150ecf120e4213a302819fe31a74c25a0fa77b25b459b3ab197b9f8",
    "file_sha256": "839aca42e3192f9a116f15bf635e269b6386cb960a109baf322ee42e7701b035",
    "instrument_epoch": "p13.6-control.1",
    "path": "runs/p13-learning-baseline-migration-v6.bundle.json"
  },
  "partition_manifest": {
    "path": "experiments/learning/partition_manifest.json",
    "sha256": "78ab72b3e07b3fc628fb8299b47f1521e7e5714196af92ba8a18cff947f0ebdb"
  },
  "payload": {
    "path": "experiments/learning/proposals/rollback-drill/p13.6-empty-baseline-drill.json",
    "sha256": "3e698be2c901278eef4bb21c1d12ae918e57149492d3363ed623283e84c1ce50"
  },
  "payload_sha256": "2cab2e4c6c231c2d189273558c6c0e2e69d85ec932d15f016b4868810222b41e",
  "previous_current_sha256": "2acfcbcbfe76e8f1fe5c28331cd34756c5a6716e24b64a5be9a4867f96fa9290",
  "promotion_record_schema_version": "promotion_record.v1",
  "record_id": "p13.6:bootstrap:p13.6-empty-baseline-drill:20260710T212852Z",
  "reward_evidence": null,
  "signature": {
    "algorithm": "rsa-sha256",
    "value_base64": "LmCzToylhDPVZpVIQ2Nvjd+jmrMtD16CtyC3Z1MHaWBsrzCqBtqeCCuIfbKHHuESgieIypBoMcWabKT9xgRIU3BknQkQY2AtGx7GqMaLJuj9oOwyioMt3lLS0BWK9yXkMpk24Cg/+A95nzzc5iKm0QIaPA1AsM0kTnRUX3+HYRNitAcYlk4Ch8rcZD5Pvnj9t1Ucxj4Ow8hWtawljx6hgZ+mkPt0vq9y1A6Pk9pq1KCKyUtJIXka9I9kKhX2+9+TULjvYK1wU6DdnrRUlWZRwn+gGAWOvgaVkq8Q2tE6MIjJE+GHnVh7NWDe5Ry/D/w1wZkODNVa+8J8WeGnNyNbbA=="
  },
  "signer": {
    "algorithm": "rsa-sha256",
    "public_key_sha256": "22b5b6479ae70799f101caecef35a51db9e3c7c52ac317b925edc7de532ac9a2",
    "role": "promoter"
  },
  "transition": "bootstrap"
}
