{
  "attestations": {
    "forward_shadow": {
      "decision": "pass",
      "path": "experiments/learning/promoter/bootstrap/forward_shadow_attestation.json",
      "sha256": "0d2ee856bd12d945f0e222c79a302ce115cc0e0025efa40e69f2347850247697"
    },
    "holdout": {
      "decision": "pass",
      "path": "experiments/learning/promoter/bootstrap/holdout_attestation.json",
      "sha256": "78829f9dce3e1a14d9c2a7361e2e68966d6e34504b355a8826821ab9b5d60dfc"
    },
    "search": {
      "decision": "pass",
      "path": "experiments/learning/promoter/bootstrap/search_attestation.json",
      "sha256": "7ebcf5bdd9d942ca56ef20267aef642efe03f2294ff0052101c8dfa28a7fee34"
    }
  },
  "binding_manifest": {
    "manifest_id": "p13-learning-baseline-migration:64575751a361:20260710T212634Z",
    "path": "runs/p13_manifests/p13-learning-baseline-migration-v6.json",
    "sha256": "7d4d2c7db1a3a858905251d54f718c5ca6666026117adbd48a7579c95830239a"
  },
  "created_at": "2026-07-10T21:28:13.124912Z",
  "decision": "pass",
  "instrument_bundle": {
    "bundle_sha256": "bb7325267150ecf120e4213a302819fe31a74c25a0fa77b25b459b3ab197b9f8",
    "file_sha256": "839aca42e3192f9a116f15bf635e269b6386cb960a109baf322ee42e7701b035",
    "instrument_epoch": "p13.6-control.1",
    "path": "runs/p13-learning-baseline-migration-v6.bundle.json"
  },
  "partition_manifest": {
    "path": "experiments/learning/partition_manifest.json",
    "sha256": "78ab72b3e07b3fc628fb8299b47f1521e7e5714196af92ba8a18cff947f0ebdb"
  },
  "payload": {
    "path": "experiments/learning/proposals/baseline/p13.6-empty-baseline.json",
    "sha256": "fcf0450ddd259bc8fda10643023e60b650c8b43e6ee2fd2999db460ecdf9a932"
  },
  "payload_sha256": "0deba3684e55688e5d6b3ebeea5003deca9af08066ab16029e899a5411804f2c",
  "previous_current_sha256": "5c86afc891cff4b521ff180c0ef29ea085b8e974ca094ec93ab80a7179adbae3",
  "promotion_record_schema_version": "promotion_record.v1",
  "record_id": "p13.6:bootstrap:p13.6-empty-baseline:20260710T212813Z",
  "reward_evidence": null,
  "signature": {
    "algorithm": "rsa-sha256",
    "value_base64": "GyHxZKxJoZTbiBgVzsTzab6y2L8ME/GKaO/YdVjdnlgovTNHC2AyADZU6MWeogcFxR4baHJfeB2+Znyr+v6dx92uWROxaVc+vPMSlcxMZfeHmq4i8J/eBHGZxPLZ8xytT4toSt5A6ot1RE1oDtpofgFihmOQIA1me7rrkiPQPXcHjdLM6O98LijyMsp/qLCSza0szDuBthgKqjxVWIroiD/YA6UjuB31wTkNXI9XOKiYka5YdFlFIc51GjEoQeq+NBW99Z7ylnxbh9ySVG5lmalZeb7FuivOy7pehQ/92jdTpj9JX3/VbofrKyqw9UsRqrqCTZRvJ5NsAnDurMzLNg=="
  },
  "signer": {
    "algorithm": "rsa-sha256",
    "public_key_sha256": "22b5b6479ae70799f101caecef35a51db9e3c7c52ac317b925edc7de532ac9a2",
    "role": "promoter"
  },
  "transition": "bootstrap"
}
